{
  "acceptance": {
    "completed_route": null,
    "gate_checks": {
      "hidden": {
        "gate": "hidden",
        "hash": "sha256:37f3acd685fd03e0624a98f328e38edffe8faef5179263e502035c707c51f4e9",
        "status": "fail",
        "version": "sealed-w1-v1 2026-07-20 6-mutants"
      },
      "public": {
        "checks": [
          {
            "detail": "git can read the subject tree (diff-scope is meaningful)",
            "id": "G0-subject-readable",
            "status": "pass"
          },
          {
            "detail": "only new test files under src/tests/",
            "id": "T1-diff-scope",
            "status": "pass"
          },
          {
            "detail": "baseline suite (article|profile|utils|tag|mapper)",
            "id": "T2-suite-green",
            "status": "pass"
          },
          {
            "detail": "src/app/routes/article/article.mapper.ts branches 0/0=100.0% (min 100.0%); src/app/routes/article/author.mapper.ts branches 5/6=83.33% (min 83.33%)",
            "id": "T3-coverage",
            "status": "pass"
          },
          {
            "detail": "agent's new tests pass on the pinned target files",
            "id": "T4-tests-pass",
            "status": "pass"
          }
        ],
        "gate": "public"
      }
    },
    "intention_to_route": null,
    "result": "rejected"
  },
  "behavior": {
    "escalations": {
      "confidence": "derived",
      "value": 0
    },
    "failures_by_category": {
      "confidence": "derived",
      "value": {}
    },
    "file_read_bytes": {
      "confidence": "unavailable",
      "reason": "byte counts not measured",
      "value": null
    },
    "file_reads": {
      "confidence": "unavailable",
      "reason": "no file_read events",
      "value": null
    },
    "files_modified": {
      "confidence": "unavailable",
      "reason": "file modifications not tracked in event log",
      "value": null
    },
    "retries": {
      "confidence": "derived",
      "value": 0
    },
    "subagent_calls": {
      "confidence": "derived",
      "value": 0
    },
    "tool_calls_by_type": {
      "confidence": "unavailable",
      "reason": "no tool_invoked events",
      "value": null
    },
    "turns": {
      "confidence": "derived",
      "value": 1
    },
    "verifier_calls": {
      "confidence": "derived",
      "value": 0
    }
  },
  "configuration_id": "C3-prev",
  "economics": {
    "cost_basis": "marginal_api_cost",
    "cost_basis_qualifier": "cache_blind_upper_bound",
    "fully_allocated_usd": {
      "confidence": "unavailable",
      "reason": "one or more legs had unavailable cost; total not zero-filled",
      "value": null
    },
    "machine_cost_usd": {
      "confidence": "unavailable",
      "reason": "not supplied to deriver",
      "value": null
    },
    "marginal_operating_usd": {
      "confidence": "unavailable",
      "reason": "one or more legs had unavailable cost; total not zero-filled",
      "value": null
    },
    "pricing_snapshot": "prices-2026-08-16.json",
    "provider_cost_usd": {
      "confidence": "unavailable",
      "reason": "not supplied to deriver",
      "value": null
    },
    "subscription_allocation_basis": {
      "confidence": "unavailable",
      "reason": "not supplied to deriver",
      "value": null
    },
    "total_cost_usd": {
      "confidence": "unavailable",
      "reason": "one or more legs had unavailable cost; total not zero-filled",
      "value": null
    }
  },
  "hidden_test_hash": "sha256:37f3acd685fd03e0624a98f328e38edffe8faef5179263e502035c707c51f4e9",
  "human_effort": {
    "active_minutes": {
      "confidence": "unavailable",
      "reason": "not recorded",
      "value": null
    },
    "blocked_minutes": {
      "confidence": "unavailable",
      "reason": "not recorded",
      "value": null
    },
    "correction_minutes": {
      "confidence": "unavailable",
      "reason": "not recorded",
      "value": null
    },
    "review_minutes": {
      "confidence": "unavailable",
      "reason": "not recorded",
      "value": null
    }
  },
  "identity": {
    "auth_billing_path": {
      "confidence": "authoritative",
      "value": "product_blackbox"
    },
    "cache_state": {
      "confidence": "authoritative",
      "value": "cold"
    },
    "contamination_tier": "famous",
    "model_or_selector": {
      "confidence": "proxy_observed",
      "value": "Gemini 3.6 Flash (High)"
    },
    "network_policy": {
      "confidence": "authoritative",
      "value": "agent-leg: egress-allowlist:model-api-v1@sha256:ce78aa16d545; 9-host-patterns; deny-by-default; internal-network=lab-egress; proxy-enforced-CONNECT-443-only | gate: none"
    },
    "permission_profile": {
      "confidence": "authoritative",
      "value": "skip-all-tools-inside-container; container-isolated; image=subject-agent; fs-namespace-confined; no-canonical|hidden|task.yaml-in-image(build-asserted); cwd-confined-/subject; harness-env-pointers-scrubbed; credentials-mounted-read-only; product-CLIs-baked-at-pinned-versions; egress-allowlisted-see-network_policy; non-root-in-container(uid-matched-to-host-operator)"
    },
    "product": {
      "confidence": "authoritative",
      "value": "Product B"
    },
    "product_version": {
      "confidence": "unavailable",
      "reason": "not supplied to deriver",
      "value": null
    },
    "provider": {
      "confidence": "authoritative",
      "value": "google"
    },
    "reasoning_config": {
      "confidence": "authoritative",
      "value": "selector_suffix:High"
    },
    "region": {
      "confidence": "unavailable",
      "reason": "not supplied to deriver",
      "value": null
    },
    "session_state": {
      "confidence": "authoritative",
      "value": "fresh"
    }
  },
  "legs": [
    {
      "cost_basis": "marginal_api_cost",
      "cost_basis_qualifier": "cache_blind_upper_bound",
      "leg_id": "main",
      "model_or_selector": {
        "confidence": "proxy_observed",
        "value": "Gemini 3.6 Flash (High)"
      },
      "provider": {
        "confidence": "authoritative",
        "value": "google"
      },
      "role": "solver",
      "usage": {
        "cache_creation_tokens": {
          "confidence": "unavailable",
          "reason": "no event reported this token class",
          "value": null
        },
        "cache_read_tokens": {
          "confidence": "unavailable",
          "reason": "no event reported this token class",
          "value": null
        },
        "input_tokens": {
          "confidence": "derived",
          "value": 887427
        },
        "output_tokens": {
          "confidence": "derived",
          "value": 13193
        },
        "reasoning_tokens": {
          "confidence": "unavailable",
          "reason": "no event reported this token class",
          "value": null
        },
        "tool_result_tokens": {
          "confidence": "unavailable",
          "reason": "no event reported this token class",
          "value": null
        }
      }
    }
  ],
  "manifest_ref": "manifest/delivery-manifest.yaml",
  "run_id": "w1-realworld-mapper-tests__C3-prev__rep2__20260818T142504",
  "task_id": "w1-realworld-mapper-tests",
  "task_suite_version": "w1-v1",
  "usage": {
    "cache_creation_tokens": {
      "confidence": "unavailable",
      "reason": "no event reported this token class",
      "value": null
    },
    "cache_read_tokens": {
      "confidence": "unavailable",
      "reason": "no event reported this token class",
      "value": null
    },
    "code_exec_charges_usd": {
      "confidence": "unavailable",
      "reason": "not exposed by this configuration",
      "value": null
    },
    "code_exec_usage": {
      "confidence": "unavailable",
      "reason": "not exposed by this configuration",
      "value": null
    },
    "input_tokens": {
      "confidence": "derived",
      "value": 887427
    },
    "output_tokens": {
      "confidence": "derived",
      "value": 13193
    },
    "reasoning_tokens": {
      "confidence": "unavailable",
      "reason": "no event reported this token class",
      "value": null
    },
    "search_charges_usd": {
      "confidence": "unavailable",
      "reason": "not exposed by this configuration",
      "value": null
    },
    "search_ops": {
      "confidence": "unavailable",
      "reason": "not exposed by this configuration",
      "value": null
    },
    "tool_result_tokens": {
      "confidence": "unavailable",
      "reason": "no event reported this token class",
      "value": null
    }
  }
}
