{
  "acceptance": {
    "completed_route": null,
    "gate_checks": {
      "hidden": {
        "gate": "hidden",
        "hash": "sha256:3d6f804981cb28f1823a91e349be923431e09a206ef9cdb8636e3bc3871886c2",
        "status": "pass",
        "version": "sealed-w4-v2 2026-07-19"
      },
      "public": {
        "checks": [
          {
            "detail": "only allowed path(s) changed vs pin",
            "id": "P6-diff-scope",
            "status": "pass"
          },
          {
            "detail": "no canonical patch / solution markers in tree",
            "id": "P5-no-leakage",
            "status": "pass"
          },
          {
            "detail": "tsc -p tsconfig.app.json --noEmit",
            "id": "P3-typecheck",
            "status": "pass"
          },
          {
            "detail": "nx build (app compiles)",
            "id": "P4-build",
            "status": "pass"
          },
          {
            "detail": "getCurrentUser repro (selects user id)",
            "id": "P1-public-test",
            "status": "pass"
          },
          {
            "detail": "DB-free unit suites (article|profile|utils)",
            "id": "P2-regression",
            "status": "pass"
          }
        ],
        "gate": "public"
      }
    },
    "intention_to_route": null,
    "result": "accepted"
  },
  "behavior": {
    "escalations": {
      "confidence": "derived",
      "value": 0
    },
    "failures_by_category": {
      "confidence": "derived",
      "value": {}
    },
    "file_read_bytes": {
      "confidence": "unavailable",
      "reason": "byte counts not measured",
      "value": null
    },
    "file_reads": {
      "confidence": "unavailable",
      "reason": "no file_read events",
      "value": null
    },
    "files_modified": {
      "confidence": "unavailable",
      "reason": "file modifications not tracked in event log",
      "value": null
    },
    "retries": {
      "confidence": "derived",
      "value": 0
    },
    "subagent_calls": {
      "confidence": "derived",
      "value": 0
    },
    "tool_calls_by_type": {
      "confidence": "unavailable",
      "reason": "no tool_invoked events",
      "value": null
    },
    "turns": {
      "confidence": "derived",
      "value": 1
    },
    "verifier_calls": {
      "confidence": "derived",
      "value": 0
    }
  },
  "configuration_id": "P0",
  "economics": {
    "cost_basis": "marginal_api_cost",
    "fully_allocated_usd": {
      "confidence": "derived",
      "value": 0.4038834
    },
    "machine_cost_usd": {
      "confidence": "unavailable",
      "reason": "not supplied to deriver",
      "value": null
    },
    "marginal_operating_usd": {
      "confidence": "derived",
      "value": 0.4038834
    },
    "pricing_snapshot": "prices-2026-07-19.json",
    "provider_cost_usd": {
      "confidence": "unavailable",
      "reason": "not supplied to deriver",
      "value": null
    },
    "subscription_allocation_basis": {
      "confidence": "unavailable",
      "reason": "not supplied to deriver",
      "value": null
    },
    "total_cost_usd": {
      "confidence": "derived",
      "value": 0.4038834
    }
  },
  "hidden_test_hash": "sha256:3d6f804981cb28f1823a91e349be923431e09a206ef9cdb8636e3bc3871886c2",
  "human_effort": {
    "active_minutes": {
      "confidence": "unavailable",
      "reason": "not recorded",
      "value": null
    },
    "blocked_minutes": {
      "confidence": "unavailable",
      "reason": "not recorded",
      "value": null
    },
    "correction_minutes": {
      "confidence": "unavailable",
      "reason": "not recorded",
      "value": null
    },
    "review_minutes": {
      "confidence": "unavailable",
      "reason": "not recorded",
      "value": null
    }
  },
  "identity": {
    "auth_billing_path": {
      "confidence": "authoritative",
      "value": "controlled_api"
    },
    "cache_state": {
      "confidence": "authoritative",
      "value": "cold"
    },
    "contamination_tier": "famous",
    "model_or_selector": {
      "confidence": "authoritative",
      "value": "claude-sonnet-4-6@default"
    },
    "network_policy": {
      "confidence": "authoritative",
      "value": "no-network-policy"
    },
    "permission_profile": {
      "confidence": "authoritative",
      "value": "skip-all-tools; cwd-confined-.work-repo; dev-vm; no-container; no-network-policy"
    },
    "product": {
      "confidence": "authoritative",
      "value": "Product A"
    },
    "product_version": {
      "confidence": "unavailable",
      "reason": "not supplied to deriver",
      "value": null
    },
    "provider": {
      "confidence": "authoritative",
      "value": "google_vertex"
    },
    "reasoning_config": {
      "confidence": "unavailable",
      "reason": "not supplied to deriver",
      "value": null
    },
    "region": {
      "confidence": "proxy_observed",
      "value": "global"
    },
    "session_state": {
      "confidence": "authoritative",
      "value": "fresh"
    }
  },
  "legs": [
    {
      "cost_basis": "marginal_api_cost",
      "fully_allocated_usd": {
        "confidence": "derived",
        "value": 0.4038834
      },
      "leg_id": "main",
      "marginal_operating_usd": {
        "basis": "marginal_api_cost",
        "components": {
          "cache_creation_tokens": 0.37848,
          "cache_read_tokens": 0.0106284,
          "input_tokens": 0.00033,
          "output_tokens": 0.014445
        },
        "confidence": "derived",
        "value": 0.4038834
      },
      "model_or_selector": {
        "confidence": "authoritative",
        "value": "claude-sonnet-4-6@default"
      },
      "provider": {
        "confidence": "authoritative",
        "value": "google_vertex"
      },
      "role": "solver",
      "usage": {
        "cache_creation_tokens": {
          "confidence": "authoritative",
          "value": 100928
        },
        "cache_read_tokens": {
          "confidence": "authoritative",
          "value": 35428
        },
        "input_tokens": {
          "confidence": "authoritative",
          "value": 110
        },
        "output_tokens": {
          "confidence": "authoritative",
          "value": 963
        },
        "reasoning_tokens": {
          "confidence": "unavailable",
          "reason": "no event reported this token class",
          "value": null
        },
        "tool_result_tokens": {
          "confidence": "unavailable",
          "reason": "no event reported this token class",
          "value": null
        }
      }
    }
  ],
  "manifest_ref": "manifest/delivery-manifest.yaml",
  "run_id": "w4-realworld-missing-user-id__P0__rep1__20260720T034118",
  "task_id": "w4-realworld-missing-user-id",
  "task_suite_version": "pilot-v1",
  "usage": {
    "cache_creation_tokens": {
      "confidence": "authoritative",
      "value": 100928
    },
    "cache_read_tokens": {
      "confidence": "authoritative",
      "value": 35428
    },
    "code_exec_charges_usd": {
      "confidence": "unavailable",
      "reason": "not exposed by this configuration",
      "value": null
    },
    "code_exec_usage": {
      "confidence": "unavailable",
      "reason": "not exposed by this configuration",
      "value": null
    },
    "input_tokens": {
      "confidence": "authoritative",
      "value": 110
    },
    "output_tokens": {
      "confidence": "authoritative",
      "value": 963
    },
    "reasoning_tokens": {
      "confidence": "unavailable",
      "reason": "no event reported this token class",
      "value": null
    },
    "search_charges_usd": {
      "confidence": "unavailable",
      "reason": "not exposed by this configuration",
      "value": null
    },
    "search_ops": {
      "confidence": "unavailable",
      "reason": "not exposed by this configuration",
      "value": null
    },
    "tool_result_tokens": {
      "confidence": "unavailable",
      "reason": "no event reported this token class",
      "value": null
    }
  }
}