{
  "acceptance": {
    "completed_route": null,
    "gate_checks": {
      "hidden": {
        "gate": "hidden",
        "hash": "sha256:f380d1424f796166353bf959939eb552492140edaf92d87c76e896d4eaa12fb6",
        "status": "fail",
        "version": "sealed-w1b-v1 2026-08-17 m=8 (M6=control)"
      },
      "public": {
        "checks": [
          {
            "detail": "git can read the subject tree (diff-scope is meaningful)",
            "id": "G0-subject-readable",
            "status": "pass"
          },
          {
            "detail": "only new test files under tests/",
            "id": "T1-diff-scope",
            "status": "pass"
          },
          {
            "detail": "baseline suite (tests/test_indexing.py + tests/test_*_properties.py)",
            "id": "T2-suite-green",
            "status": "fail"
          },
          {
            "detail": "coverage summary not produced",
            "id": "T3-coverage",
            "status": "fail"
          },
          {
            "detail": "agent's new tests pass on the pinned target files",
            "id": "T4-tests-pass",
            "status": "fail"
          }
        ],
        "gate": "public"
      }
    },
    "intention_to_route": null,
    "result": "rejected"
  },
  "behavior": {
    "escalations": {
      "confidence": "derived",
      "value": 0
    },
    "failures_by_category": {
      "confidence": "derived",
      "value": {}
    },
    "file_read_bytes": {
      "confidence": "unavailable",
      "reason": "byte counts not measured",
      "value": null
    },
    "file_reads": {
      "confidence": "unavailable",
      "reason": "no file_read events",
      "value": null
    },
    "files_modified": {
      "confidence": "unavailable",
      "reason": "file modifications not tracked in event log",
      "value": null
    },
    "retries": {
      "confidence": "derived",
      "value": 0
    },
    "subagent_calls": {
      "confidence": "derived",
      "value": 0
    },
    "tool_calls_by_type": {
      "confidence": "unavailable",
      "reason": "no tool_invoked events",
      "value": null
    },
    "turns": {
      "confidence": "derived",
      "value": 1
    },
    "verifier_calls": {
      "confidence": "derived",
      "value": 0
    }
  },
  "configuration_id": "C2",
  "economics": {
    "cost_basis": "marginal_api_cost",
    "fully_allocated_usd": {
      "confidence": "derived",
      "value": 2.0608935
    },
    "machine_cost_usd": {
      "confidence": "unavailable",
      "reason": "not supplied to deriver",
      "value": null
    },
    "marginal_operating_usd": {
      "confidence": "derived",
      "value": 2.0608935
    },
    "pricing_snapshot": "prices-2026-08-16.json",
    "provider_cost_usd": {
      "confidence": "unavailable",
      "reason": "not supplied to deriver",
      "value": null
    },
    "subscription_allocation_basis": {
      "confidence": "unavailable",
      "reason": "not supplied to deriver",
      "value": null
    },
    "total_cost_usd": {
      "confidence": "derived",
      "value": 2.0608935
    }
  },
  "hidden_test_hash": "sha256:f380d1424f796166353bf959939eb552492140edaf92d87c76e896d4eaa12fb6",
  "human_effort": {
    "active_minutes": {
      "confidence": "unavailable",
      "reason": "not recorded",
      "value": null
    },
    "blocked_minutes": {
      "confidence": "unavailable",
      "reason": "not recorded",
      "value": null
    },
    "correction_minutes": {
      "confidence": "unavailable",
      "reason": "not recorded",
      "value": null
    },
    "review_minutes": {
      "confidence": "unavailable",
      "reason": "not recorded",
      "value": null
    }
  },
  "identity": {
    "auth_billing_path": {
      "confidence": "authoritative",
      "value": "controlled_api"
    },
    "cache_state": {
      "confidence": "authoritative",
      "value": "cold"
    },
    "contamination_tier": "post_cutoff",
    "model_or_selector": {
      "confidence": "authoritative",
      "value": "claude-sonnet-4-6@default"
    },
    "network_policy": {
      "confidence": "authoritative",
      "value": "agent-leg: egress-allowlist:model-api-v1@sha256:ce78aa16d545; 9-host-patterns; deny-by-default; internal-network=lab-egress; proxy-enforced-CONNECT-443-only | gate: none"
    },
    "permission_profile": {
      "confidence": "authoritative",
      "value": "skip-all-tools-inside-container; container-isolated; image=subject-agent; fs-namespace-confined; no-canonical|hidden|task.yaml-in-image(build-asserted); cwd-confined-/subject; harness-env-pointers-scrubbed; credentials-mounted-read-only; product-CLIs-baked-at-pinned-versions; egress-allowlisted-see-network_policy; non-root-in-container(uid-matched-to-host-operator)"
    },
    "product": {
      "confidence": "authoritative",
      "value": "Product A"
    },
    "product_version": {
      "confidence": "unavailable",
      "reason": "not supplied to deriver",
      "value": null
    },
    "provider": {
      "confidence": "authoritative",
      "value": "google_vertex"
    },
    "reasoning_config": {
      "confidence": "unavailable",
      "reason": "not supplied to deriver",
      "value": null
    },
    "region": {
      "confidence": "proxy_observed",
      "value": "global"
    },
    "session_state": {
      "confidence": "authoritative",
      "value": "fresh"
    }
  },
  "legs": [
    {
      "cost_basis": "marginal_api_cost",
      "fully_allocated_usd": {
        "confidence": "derived",
        "value": 2.0608935
      },
      "leg_id": "main",
      "marginal_operating_usd": {
        "basis": "marginal_api_cost",
        "components": {
          "cache_creation_tokens": 0.711174,
          "cache_read_tokens": 0.5718285,
          "input_tokens": 9.6e-05,
          "output_tokens": 0.777795
        },
        "confidence": "derived",
        "rate_keys": {
          "cache_creation_tokens": "cache_write_1h",
          "cache_read_tokens": "cache_read",
          "input_tokens": "input",
          "output_tokens": "output"
        },
        "value": 2.0608935
      },
      "model_or_selector": {
        "confidence": "authoritative",
        "value": "claude-sonnet-4-6@default"
      },
      "provider": {
        "confidence": "authoritative",
        "value": "google_vertex"
      },
      "role": "solver",
      "usage": {
        "cache_creation_tokens": {
          "confidence": "authoritative",
          "value": 118529
        },
        "cache_read_tokens": {
          "confidence": "authoritative",
          "value": 1906095
        },
        "input_tokens": {
          "confidence": "authoritative",
          "value": 32
        },
        "output_tokens": {
          "confidence": "authoritative",
          "value": 51853
        },
        "reasoning_tokens": {
          "confidence": "unavailable",
          "reason": "no event reported this token class",
          "value": null
        },
        "tool_result_tokens": {
          "confidence": "unavailable",
          "reason": "no event reported this token class",
          "value": null
        }
      }
    }
  ],
  "manifest_ref": "manifest/delivery-manifest.yaml",
  "run_id": "w1b-zarr-block-mask-properties__C2__rep2__20260819T130655",
  "task_id": "w1b-zarr-block-mask-properties",
  "task_suite_version": "screening-v1",
  "usage": {
    "cache_creation_tokens": {
      "confidence": "authoritative",
      "value": 118529
    },
    "cache_read_tokens": {
      "confidence": "authoritative",
      "value": 1906095
    },
    "code_exec_charges_usd": {
      "confidence": "unavailable",
      "reason": "not exposed by this configuration",
      "value": null
    },
    "code_exec_usage": {
      "confidence": "unavailable",
      "reason": "not exposed by this configuration",
      "value": null
    },
    "input_tokens": {
      "confidence": "authoritative",
      "value": 32
    },
    "output_tokens": {
      "confidence": "authoritative",
      "value": 51853
    },
    "reasoning_tokens": {
      "confidence": "unavailable",
      "reason": "no event reported this token class",
      "value": null
    },
    "search_charges_usd": {
      "confidence": "unavailable",
      "reason": "not exposed by this configuration",
      "value": null
    },
    "search_ops": {
      "confidence": "unavailable",
      "reason": "not exposed by this configuration",
      "value": null
    },
    "tool_result_tokens": {
      "confidence": "unavailable",
      "reason": "no event reported this token class",
      "value": null
    }
  }
}