{
  "acceptance": {
    "completed_route": "strong",
    "gate_checks": {
      "hidden": {
        "gate": "hidden",
        "hash": "sha256:105c24189877b52fe57b1e453f53f73366ad3c7fa1a611a8a2a63042b667abe2",
        "status": "fail",
        "version": "sealed-pilot-v1 2026-07-19"
      },
      "public": {
        "checks": [
          {
            "detail": "unexpected changes (incl. any test-file edit): src/tests/services/article.service.test.ts",
            "id": "P6-diff-scope",
            "status": "fail"
          },
          {
            "detail": "no canonical patch / solution markers in tree",
            "id": "P5-no-leakage",
            "status": "pass"
          },
          {
            "detail": "tsc -p tsconfig.app.json --noEmit",
            "id": "P3-typecheck",
            "status": "pass"
          },
          {
            "detail": "nx build (app compiles)",
            "id": "P4-build",
            "status": "pass"
          },
          {
            "detail": "Draft articles feature spec (create persists draft; list excludes drafts)",
            "id": "P1-public-test",
            "status": "fail"
          },
          {
            "detail": "DB-free unit suites (article|profile|utils)",
            "id": "P2-regression",
            "status": "pass"
          }
        ],
        "gate": "public"
      }
    },
    "intention_to_route": "economical",
    "result": "rejected"
  },
  "behavior": {
    "escalations": {
      "confidence": "derived",
      "value": 1
    },
    "failures_by_category": {
      "confidence": "derived",
      "value": {}
    },
    "file_read_bytes": {
      "confidence": "unavailable",
      "reason": "byte counts not measured",
      "value": null
    },
    "file_reads": {
      "confidence": "unavailable",
      "reason": "no file_read events",
      "value": null
    },
    "files_modified": {
      "confidence": "unavailable",
      "reason": "file modifications not tracked in event log",
      "value": null
    },
    "retries": {
      "confidence": "derived",
      "value": 1
    },
    "subagent_calls": {
      "confidence": "derived",
      "value": 0
    },
    "tool_calls_by_type": {
      "confidence": "unavailable",
      "reason": "no tool_invoked events",
      "value": null
    },
    "turns": {
      "confidence": "derived",
      "value": 2
    },
    "verifier_calls": {
      "confidence": "derived",
      "value": 0
    }
  },
  "configuration_id": "P1",
  "economics": {
    "cost_basis": "marginal_api_cost",
    "fully_allocated_usd": {
      "confidence": "derived",
      "value": 0.4625844
    },
    "machine_cost_usd": {
      "confidence": "unavailable",
      "reason": "not supplied to deriver",
      "value": null
    },
    "marginal_operating_usd": {
      "confidence": "derived",
      "value": 0.4625844
    },
    "pricing_snapshot": "prices-2026-07-19.json",
    "provider_cost_usd": {
      "confidence": "unavailable",
      "reason": "not supplied to deriver",
      "value": null
    },
    "subscription_allocation_basis": {
      "confidence": "unavailable",
      "reason": "not supplied to deriver",
      "value": null
    },
    "total_cost_usd": {
      "confidence": "derived",
      "value": 0.4625844
    }
  },
  "hidden_test_hash": "sha256:105c24189877b52fe57b1e453f53f73366ad3c7fa1a611a8a2a63042b667abe2",
  "human_effort": {
    "active_minutes": {
      "confidence": "unavailable",
      "reason": "not recorded",
      "value": null
    },
    "blocked_minutes": {
      "confidence": "unavailable",
      "reason": "not recorded",
      "value": null
    },
    "correction_minutes": {
      "confidence": "unavailable",
      "reason": "not recorded",
      "value": null
    },
    "review_minutes": {
      "confidence": "unavailable",
      "reason": "not recorded",
      "value": null
    }
  },
  "identity": {
    "auth_billing_path": {
      "confidence": "authoritative",
      "value": "controlled_api"
    },
    "cache_state": {
      "confidence": "authoritative",
      "value": "cold"
    },
    "contamination_tier": "famous",
    "model_or_selector": {
      "confidence": "authoritative",
      "value": "claude-haiku-4-5@20251001"
    },
    "network_policy": {
      "confidence": "unavailable",
      "reason": "not supplied to deriver",
      "value": null
    },
    "permission_profile": {
      "confidence": "unavailable",
      "reason": "not supplied to deriver",
      "value": null
    },
    "product": {
      "confidence": "authoritative",
      "value": "Product A"
    },
    "product_version": {
      "confidence": "unavailable",
      "reason": "not supplied to deriver",
      "value": null
    },
    "provider": {
      "confidence": "authoritative",
      "value": "google_vertex"
    },
    "reasoning_config": {
      "confidence": "unavailable",
      "reason": "not supplied to deriver",
      "value": null
    },
    "region": {
      "confidence": "proxy_observed",
      "value": "global"
    },
    "session_state": {
      "confidence": "authoritative",
      "value": "fresh"
    }
  },
  "legs": [
    {
      "cost_basis": "marginal_api_cost",
      "fully_allocated_usd": {
        "confidence": "derived",
        "value": 0.09011565
      },
      "leg_id": "economical_attempt",
      "marginal_operating_usd": {
        "basis": "marginal_api_cost",
        "components": {
          "cache_creation_tokens": 0.02180625,
          "cache_read_tokens": 0.0465264,
          "input_tokens": 8.3e-05,
          "output_tokens": 0.0217
        },
        "confidence": "derived",
        "value": 0.09011565
      },
      "model_or_selector": {
        "confidence": "authoritative",
        "value": "claude-haiku-4-5@20251001"
      },
      "provider": {
        "confidence": "authoritative",
        "value": "google_vertex"
      },
      "role": "economical",
      "usage": {
        "cache_creation_tokens": {
          "confidence": "authoritative",
          "value": 17445
        },
        "cache_read_tokens": {
          "confidence": "authoritative",
          "value": 465264
        },
        "input_tokens": {
          "confidence": "authoritative",
          "value": 83
        },
        "output_tokens": {
          "confidence": "authoritative",
          "value": 4340
        },
        "reasoning_tokens": {
          "confidence": "unavailable",
          "reason": "no event reported this token class",
          "value": null
        },
        "tool_result_tokens": {
          "confidence": "unavailable",
          "reason": "no event reported this token class",
          "value": null
        }
      }
    },
    {
      "cost_basis": "marginal_api_cost",
      "fully_allocated_usd": {
        "confidence": "derived",
        "value": 0.37246875
      },
      "leg_id": "strong_attempt",
      "marginal_operating_usd": {
        "basis": "marginal_api_cost",
        "components": {
          "cache_creation_tokens": 0.17527125,
          "cache_read_tokens": 0.1526655,
          "input_tokens": 0.000357,
          "output_tokens": 0.044175
        },
        "confidence": "derived",
        "value": 0.37246875
      },
      "model_or_selector": {
        "confidence": "authoritative",
        "value": "claude-sonnet-4-6@default"
      },
      "provider": {
        "confidence": "authoritative",
        "value": "google_vertex"
      },
      "role": "strong",
      "usage": {
        "cache_creation_tokens": {
          "confidence": "authoritative",
          "value": 46739
        },
        "cache_read_tokens": {
          "confidence": "authoritative",
          "value": 508885
        },
        "input_tokens": {
          "confidence": "authoritative",
          "value": 119
        },
        "output_tokens": {
          "confidence": "authoritative",
          "value": 2945
        },
        "reasoning_tokens": {
          "confidence": "unavailable",
          "reason": "no event reported this token class",
          "value": null
        },
        "tool_result_tokens": {
          "confidence": "unavailable",
          "reason": "no event reported this token class",
          "value": null
        }
      }
    }
  ],
  "manifest_ref": "manifest/delivery-manifest.yaml",
  "run_id": "pilot-realworld-draft-articles__P1__rep3__20260719T113011",
  "task_id": "pilot-realworld-draft-articles",
  "task_suite_version": "pilot-v1",
  "usage": {
    "cache_creation_tokens": {
      "confidence": "authoritative",
      "value": 64184
    },
    "cache_read_tokens": {
      "confidence": "authoritative",
      "value": 974149
    },
    "code_exec_charges_usd": {
      "confidence": "unavailable",
      "reason": "not exposed by this configuration",
      "value": null
    },
    "code_exec_usage": {
      "confidence": "unavailable",
      "reason": "not exposed by this configuration",
      "value": null
    },
    "input_tokens": {
      "confidence": "authoritative",
      "value": 202
    },
    "output_tokens": {
      "confidence": "authoritative",
      "value": 7285
    },
    "reasoning_tokens": {
      "confidence": "unavailable",
      "reason": "no event reported this token class",
      "value": null
    },
    "search_charges_usd": {
      "confidence": "unavailable",
      "reason": "not exposed by this configuration",
      "value": null
    },
    "search_ops": {
      "confidence": "unavailable",
      "reason": "not exposed by this configuration",
      "value": null
    },
    "tool_result_tokens": {
      "confidence": "unavailable",
      "reason": "no event reported this token class",
      "value": null
    }
  }
}